28364,Towards the Support of User Preferences in Search-Based Product Line Architecture Design: An Exploratory Study,2,"Bindewald, Carlos Vinicius and Freire, Willian M. and Amaral, Aline M. M. Miotto and Colanzi, Thelma Elita","Software Product Lines (SPLs) is a reuse approach in which a family of products isgeneralized in a common architecture that can be adapted to different clients. TheProduct Line Architecture (PLA) is one of the most important artifacts of a SPL. PLAdesign requires great human effort as it involves several factors that are usuallyin conflict. To ease this task, PLA design can be formulated as an optimization problemwith many factors, i.e, as a multi-objective optimization problem. In this context,the MOA4PLA approach was proposed to optimize PLA design using search algorithms andmetrics specific to the context. This approach supported by OPLA-Tool has alreadybeen used in several works demonstrating its applicability. However, MOA4PLA doesnot take into account aspects that are subjective, such as the preferences of a particularDecision Maker (DM). To do so, this paper presents a proposal to incorporate the userpreferences in the optimization process performed by MOA4PLA, through an interactiveprocess in which the DM subjectively evaluates the solutions in processing time. Thus,the solutions generated can be better suited to the DM's needs or preferences. Inorder to allow the user interaction, modifications were made in MOA4PLA and implementedin the OPLA-Tool. Aiming at an initial validation of the proposal, an exploratorystudy was carried out, composed of two experiments: a qualitative and a quantitative.These experiments were realized with the participation of a software architect. Empiricalresults pointed out that the proposed interactive process enables the generation ofPLAs that are in accordance with the architect's preferences. Another significantcontribution are the lessons learned on how to improve the interactive process.",ACCEPTED,ACCEPTED,LOW,19,2019,Proceedings of the XXXIII Brazilian Symposium on Software Engineering,"Multi-Objective Optimization, Human-computer interaction, Product Line Architecture",,,https://doi.org/10.1145/3350768.3351993,,387–396,10.1145/3350768.3351993,9781450376518,08/18/2021,,Y,N,N,N,N,N,N,,N,Y,N,N,N,3,3,3,score,Likert,Y,N,NSGAII,MLP,Object representing Product Line Architecture,Product Line Architecture,"when solution eval. = 1, solution is removed; eval. = 5, solution is freezed; otherwise, solution return to optimization process",N,Y,NSGAII,MLP,Opinion about PLA,N,Y,N,N
28371,Supporting User Preferences in Search-Based Product Line Architecture Design Using Machine Learning,2,"Bindewald, Carlos Vinicius and Freire, Willian M. and Amaral, Aline M. M. Miotto and Colanzi, Thelma Elita","The Product Line Architecture (PLA) is one of the most important artifacts of a SoftwareProduct Line. PLA design requires intensive human effort as it involves several conflictingfactors. In order to support this task, an interactive search-based approach, automatedby a tool named OPLA-Tool, was proposed in a previous work. Through this tool thesoftware architect evaluates the generated solutions during the optimization process.Considering that evaluating PLA is a complex task and search-based algorithms demanda high number of generations, the evaluation of all solutions in all generations causehuman fatigue. In this work, we incorporated in OPLA-Tool a Machine Learning (ML)model to represent the architect in some moments during the optimization process aimingto decrease the architect's effort. Through the execution of a quantiqualitative exploratorystudy it was possible to demonstrate the reduction of the fatigue problem and thatthe solutions produced at the end of the process, in most cases, met the architect'sneeds.",ACCEPTED,ACCEPTED,LOW,11,2020,"Proceedings of the 14th Brazilian Symposium on Software Components, Architectures, and Reuse","Machine Learning, Product Line Architecture, Human-computer interaction",,,https://doi.org/10.1145/3425269.3425278,,11–20,10.1145/3425269.3425278,9781450387545,08/18/2021,,Y,N,N,N,N,N,N,,Y,N,N,N,N,3,3,3,score,Likert,Y,N,NSGAII,MLP,Object representing PLA,PLA,1 remove solution 5 freeze,Y,Y,NSGAII,MLP,opinion about PLA,N,Y,N,N
28396,Multiple Objective Test Set Selection for Software Product Line Testing: Evaluating Different Preference-Based Algorithms,2,"Filho, Helson Luiz Jakubovski and Ferreira, Thiago Nascimento and Vergilio, Silvia Regina","The selection of optimal test sets for Software Product Lines (SPLs) is a complextask impacted by many factors and that needs to consider the tester's preferences.To help in this task, Preference-based Evolutionary Multi-objective Algorithms (PEMOAs)have been explored. They use a Reference Point (RP), which represents the user preferenceand guides the search, resulting in a greater number of solutions in the ROI (Regionof Interest). This region contains solutions that are more interesting from the tester'spoint of view. However, the explored PEMOAs have not been compared yet and the resultsreported in the literature do not consider many-objective formulations. Such an evaluationis important because in the presence of more than three objectives the performanceof the algorithms may change and the number of solutions increases. Considering thisfact, this work presents evaluation results of four PEMOAs for selection of productsin the SPL testing considering cost, testing criteria coverage, products similarity,and the number of revealed faults, given by the mutation score. The PEMOAs presentbetter performance than traditional algorithms, avoiding uninteresting solutions.We introduce a hyper-heuristic version of the PEMOA R-NSGA-II that presents the bestresults in a general case.",ACCEPTED,ACCEPTED,LOW,7,2018,Proceedings of the XXXII Brazilian Symposium on Software Engineering,"preference-based multi-objective algorithms, search-based software engineering, software product line testing",,,https://doi.org/10.1145/3266237.3266275,,162–171,10.1145/3266237.3266275,9781450365031,08/18/2021,,Y,N,N,N,N,N,N,,N,Y,N,N,N,not specified,not specified,not specified,not specified,not specified,N,Y,r-NSGAII,not specified,not specified,Test Selection,not specified,N,N,not specified,not specified,not specified,N,Y,N,N
28467,Integrating the Designer In-the-Loop for Metamodel/Model Co-Evolution via Interactive Computational Search,2,"Kessentini, Wael and Wimmer, Manuel and Sahraoui, Houari","Metamodels evolve even more frequently than programming languages. This evolutionprocess may result in a large number of instance models that are no longer conformingto the revised meta-model. On the one hand, the manual adaptation of models afterthe metamodels' evolution can be tedious, error-prone, and time-consuming. On theother hand, the automated co-evolution of metamodels/models is challenging especiallywhen new semantics is introduced to the metamodels. In this paper, we propose an interactivemulti-objective approach that dynamically adapts and interactively suggests edit operationsto developers and takes their feedback into consideration. Our approach uses NSGA-IIto find a set of good edit operation sequences that minimizes the number of conformanceerrors, maximizes the similarity with the initial model (reduce the loss of information)and minimizes the number of proposed edit operations. The designer can approve, modify,or reject each of the recommended edit operations, and this feedback is then usedto update the proposed rankings of recommended edit operations. We evaluated our approachon a set of metamodel/model coevolution case studies and compared it to fully automatedcoevolution techniques.",ACCEPTED,ACCEPTED,LOW,6,2018,Proceedings of the 21th ACM/IEEE International Conference on Model Driven Engineering Languages and Systems,"Coupled Evolution, Search Based Software Engineering, Metamodel/Model Co-Evolution, Interactive Optimization",,,https://doi.org/10.1145/3239372.3239375,,101–111,10.1145/3239372.3239375,9781450349499,08/18/2021,,Y,N,N,N,N,N,N,,N,Y,N,N,N,not specified,not specified,not specified,not specified,not specified,N,Y,NSGAII,not specified,not specified,Class diagram,not specified,N,N,not specified,not specified,not specified,N,Y,N,N
28479,OPLA-Tool v2.0: A Tool for Product Line Architecture Design Optimization,2,"Freire, Willian Marques and Massago, Mamoru and Zavadski, Arthur Cattaneo and Malachini, Aline Maria and Amaral, Miotto and Colanzi, Thelma Elita","The Multi-objective Optimization Approach for Product Line Architecture Design (MOA4PLA)is the seminal approach that successfully optimizes Product Line Architecture (PLA)design using search algorithms. The tool named OPLA-Tool was developed in order toautomate the use of MOA4PLA. Over time, the customization of the tool to suit theneeds of new research and application scenarios led to several problems. The mainproblems identified in the original version of OPLA-Tool are environment configuration,maintainability and usability problems, and PLA design modeling and visualization.Such problems motivated the development of a new version of this tool: OPLA-Tool v2.0,presented in this work. In this version, those problems were solved by the sourcecode refactoring, migration to a web-based graphical user interface (GUI) and inclusionof a new support tool for PLA modeling and visualization. Furthermore, OPLA-Tool v2.0has new functionalities, such as new objective functions, new search operators, intelligentinteraction with users during the optimization process, multi-user authenticationand simultaneous execution of several experiments to PLA optimization. Such a newversion of OPLA-Tool is an important achievement to PLA design optimization as itprovides an easier and more complete way to automate this task.",ACCEPTED,ACCEPTED,LOW,17,2020,Proceedings of the 34th Brazilian Symposium on Software Engineering,"product line architecture, Software product line, multi-objective evolutionary algorithms",,,https://doi.org/10.1145/3422392.3422498,,818–823,10.1145/3422392.3422498,9781450387538,08/18/2021,,Y,N,N,N,N,N,N,,N,N,N,Y,N,specified by user,specified by user,specified by user,score,Likert,Y,N,none,none,Object representing PLA,PLA,score 1 remove solution and 5 mantain immutable,N,N,none,none,score and freeze,N,Y,N,N
28752,Metaheuristic Design Pattern: Preference,2,"Aljawawdeh, Hamzeh J. and Simons, Christopher L. and Odeh, Mohammed","In interactive metaheuristic search, the human helps to steer the trajectory of thesearch by providing qualitative evaluation to assist in the selection of solutionindividuals. It can be challenging to design mechanisms to exploit human qualitativeevaluation taking into account human trade-off judgments among competing criteriaand implicit knowledge and experience. This paper addresses this challenge by proposingthe Preference metaheuristic design pattern involving six abstractions across twodimensions: explicit and implicit knowledge and a priori, interactive and a posterioritimings.",ACCEPTED,ACCEPTED,LOW,0,2015,Proceedings of the Companion Publication of the 2015 Annual Conference on Genetic and Evolutionary Computation,"preference, interactive metaheuristic search, design patterns",,,https://doi.org/10.1145/2739482.2768498,,1257–1260,10.1145/2739482.2768498,9781450334884,08/18/2021,,Y,N,N,N,N,N,N,,Y,N,N,N,N,not specified,not specified,not specified,not specified,not specified,N,Y,not specified,not specified,not specified,not specified,not specified,N,N,not specified,not specified,not specified,N,N,N,Y
48675,Qualitative optimization in software engineering: A short survey,3,Ganesh Ram Santhanam,"Many software engineering problems involve finding optimal solutions from a set of feasible solutions. Such methods often require stakeholders such as developers and testers to specify preferences over multiple attributes/objectives that are to be optimized. However, in many cases it is more natural for stakeholders to express such preferences in simple, qualitative terms. We survey relevant literature within software engineering for problems in which qualitative optimization techniques can be useful. We also present a model of optimization that relies on the stakeholders qualitative preferences leveraging recent advances in decision theoretic artificial intelligence, which could prove useful and spawn connections between qualitative decision theory and software engineering.",ACCEPTED,ACCEPTED,LOW,31,2016,Journal of Systems and Software,"Qualitative optimization, Search-based software engineering, Decision-support, Preferences",,,https://www.sciencedirect.com/science/article/pii/S0164121215002022,111,149-156,https://doi.org/10.1016/j.jss.2015.09.001,0164-1212,08/31/2021,,Y,N,N,N,N,N,N,,Y,N,N,N,N,none,none,none,none,none,N,Y,none,none,none,none,none,N,N,none,none,null,Y,N,N,N
48783,Chapter Four - Preference Incorporation in Evolutionary Multiobjective Optimization: A Survey of the State-of-the-Art,3,Slim Bechikh and Marouane Kessentini and Lamjed Ben Said and Khaled Ghédira,"After using Evolutionary Algorithms (EAs) for solving multiobjective optimization problems for more than two decades, the incorporation of the decision maker's (DM’s) preferences within the evolutionary process has finally become an active research area. In fact, EAs have demonstrated their effectiveness and efficiency in providing a well-converged and well-distributed approximation of the Pareto front. However, in reality, the DM is not interested in discovering the whole Pareto front rather than approximating the portion of the front that best matches his/her preferences, i.e., the Region Of Interest. For this reason, many new preference-based Multiobjective Optimization EAs (MOEAs), which are mostly variations of existing methods, have been recently published in the specialized literature. The purpose of this chapter is to summarize and organize the information on these current approaches in an attempt to motivate researchers to further focus on hybridizing between decision making and evolutionary multiobjective optimization research fields; consequently facilitating the DM's task when selecting the final alternative to realize. Hence, a summary of the main preference-based MOEAs is provided together with a brief criticism that includes their pros and cons. Furthermore, we propose a classification of such type of algorithms based on the DM's preference information structure. Finally, the future trends in this research area and some possible paths for future research are outlined.",ACCEPTED,ACCEPTED,LOW,24,2015,,"Multiobjective optimization, Evolutionary Algorithms, Decision maker's preferences, Decision making",,,https://www.sciencedirect.com/science/article/pii/S0065245815000273,98,141-207,https://doi.org/10.1016/bs.adcom.2015.03.001,0065-2458,08/31/2021,,Y,N,N,N,N,N,N,,Y,N,N,N,N,none,none,none,none,none,N,Y,none,none,none,none,none,N,N,none,none,none,Y,N,N,N
