26185,Incorporating decision maker’s preferences in a multi-objective approach for the software release planning,1,"Saraiva, R. and Araújo, A.A. and Dantas, A. and Yeltsin, I. and Souza, J.","Background: Release planning (RP) is one of the most complex and relevant activities in the iterative and incremental software development, because it addresses all decisions associated with the selection and assignment of requirements to releases. There are many approaches in which RP is formalized as an optimization problem. In this context, search-based software engineering (SBSE) deals with the application of search techniques to solve complex problems of software engineering. Since RP is a wicked problem with a large focus on human intuition, the decision maker’s (DM) opinion is a relevant issue to be considered when solving release planning problem. Thus, we emphasize the importance in gathering the DM’s preferences to guide the optimization process through search space area of his/her interests. Methods: Typically, RP is modelled as a multi-objective problem by considering to maximize overall clients satisfaction and minimize project risk. In this paper, we extend this notion and consider DM’s preferences as an additional objective. The DM defines a set of preferences about the requirements allocation which is stored in a preference base responsible for influencing the search process. The approach was validated through an empirical study, which consists of two different experiments, respectively identified as (a) automatic experiment and (b) participant-based experiment. Basically, the former aims to analyze the approach using different search-based algorithms (NSGA-II, MOCell, IBEA, and SPEA-II), over artificial and real-world instances, whereas the latter aims at evaluating the use of the proposal in a real scenario composed of human evaluations. Results: The automatic experiment points out that NSGA-II obtained overall superiority in two of the three datasets investigated, positioning itself as a superior search technique for scenarios with few number of requirements and preferences, while IBEA showed to be better for larger ones (with more requirements and preferences). Regarding the participant-based experiment, it was found that two thirds of the participants evaluated the preference-based solution better than the non-preference-based one. Conclusions: The results suggest that it is feasible to investigate the approach in a real-world scenario. In addition, we made available a prototype tool in order to incorporate the human’s preferences about the requirements allocation into the solution of release planning. © 2017, The Author(s).",ACCEPTED,ACCEPTED,LOW,32,2017,Journal of the Brazilian Computer Society,Human preferences;  Multi-objective optimization;  Release planning;  Search-based software engineering,Article,,https://www.scopus.com/inward/record.uri?eid=2-s2.0-85026754760&doi=10.1186%2fs13173-017-0060-0&partnerID=40&md5=54cb580cb25b9dd1aacb805c1060b98f,23,,10.1186/s13173-017-0060-0,,08/16/2021,,Y,N,N,N,N,N,N,,N,Y,N,N,N,not specified,not specified,not specified,score,1-10,N,Y,"NSGA-II, MoCell, IBEA, SPEA-II",none,"Vector of integers representing the release, that is composed of requirements xi, where xi = 1 means alocated and xi = 0 means not.",Release planning,objective function,Y,Y,NSGA-II and IBEA,none,"Coupling joint, coupling disjoint, positioning preced, follow, before, after, in, on",N,Y,N,N
26186,Incorporating user preferences in search-based software engineering: A systematic mapping study,1,"Ferreira, T.N. and Vergilio, S.R. and de Souza, J.T.","Context Search-based algorithms have been successfully applied to solve software engineering problems in the field known as Search-based Software Engineering (SBSE). However, in practice, the user may reject the obtained solutions, since many characteristics of the problem cannot be mathematically modeled. To cope with this situation, preference-based algorithms have been investigated and raised interest in the SBSE field. Objective To identify the quantity and type of research on SBSE preference-based approaches and to contribute to this new research subject, named here Preference and Search-Based Software Engineering (PSBSE), Method We conducted a systematic mapping, following a research plan to locate, assess, extract and group the outcomes from relevant studies. Results Few software engineering activities have been addressed. The most used algorithms are evolutionary and single-objective. In most studies the preferences are provided interactively and, in many cases, the user preferences are incorporated in the fitness functions. We observe a lack of evaluation measures and works comparing existing approaches. Conclusions The use of preference-based algorithms in SBSE is an underexplored subject, and many research opportunities exist. © 2017",ACCEPTED,ACCEPTED,LOW,55,2017,Information and Software Technology,Preference-based algorithms;  Search-based software engineering;  Systematic mapping,Review,,https://www.scopus.com/inward/record.uri?eid=2-s2.0-85019070974&doi=10.1016%2fj.infsof.2017.05.003&partnerID=40&md5=948a267dbc0c3bf1448252a0e0351bed,90,55-69,10.1016/j.infsof.2017.05.003,,08/16/2021,,Y,Y,N,N,N,N,N,,N,N,N,N,Y,not applicable,not applicable,not applicable,not applicable,not applicable,N,Y,not applicable,not applicable,not applicable,not applicable,not applicable,N,N,not applicable,not applicable,null,Y,N,N,N
26189,An Architecture based on interactive optimization and machine learning applied to the next release problem,1,"Araújo, A.A. and Paixao, M. and Yeltsin, I. and Dantas, A. and Souza, J.","The next release problem (NRP) consists of selecting which requirements will be implemented in the next release of a software system. For many search based software engineering approaches to the NRP, there is still a lack of capability to efficiently incorporate human experience and preferences in the search process. Therefore, this paper proposes an architecture to deal with this issue, where the decision maker (DM) and his/her tacit assessments are taken into account during the solutions evaluations alongside the interactive genetic algorithm. Furthermore, a learning model is employed to avoid an overwhelming number of interactions. An empirical study involving software engineer practitioners, different instances, and different machine learning techniques was performed to assess the feasibility of the architecture to incorporate human knowledge in the overall optimization process. Obtained results indicate the architecture can assist the DM in selecting a set of requirements that properly incorporate his/her expertise, while optimizing other explicit measurable aspects equally important to the next release planning. On a scale of 0 (very ineffective) to 5 (very effective), all participants found the experience of interactively selecting the requirements using the approach as a 4 (effective). © 2016, Springer Science+Business Media New York.",ACCEPTED,ACCEPTED,LOW,28,2017,Automated Software Engineering,Interactive optimization;  Machine learning;  Next release problem;  Search based software engineering,Article,,https://www.scopus.com/inward/record.uri?eid=2-s2.0-85020054999&doi=10.1007%2fs10515-016-0200-3&partnerID=40&md5=7bea192a555f5f993c6b0f950cafb33f,24,623-671,10.1007/s10515-016-0200-3,,08/16/2021,,Y,N,N,N,N,N,N,,N,Y,N,N,N,50,none,none,score,1-100,N,Y,genetic algorithm,"LMS, MLP","Binary solution, where xi=1 -> requirement included, otherwise 0 = not included",next release problem,objective function,Y,Y,none,LMS on artificial data and MLP on participant-based data,"explicit (score - cost, etc) and implicit (subjective evaluation)",N,N,Y,N
26195,Incorporating user preferences in ant colony optimization for the next release problem,1,"Ferreira, T.D.N. and Araújo, A.A. and Basílio Neto, A.D. and de Souza, J.T.","The selection of which requirements should be implemented in the next software release is an important and complex task in the software development process, considering the presence of budget constraints and other conflicting aspects. In this context, search based software engineering, has the main objective of applying automatic search methods to solve complex software engineering problems. However, most of these methods do not consider human expertise during the search, especially due to the difficulty in mathematically modeling the user's preferences. Consequently, the user can present some resistance or place little confidence in the final results, given that his/her knowledge and domain expertise was not properly considered in the solution construction. This paper aims at proposing an interactive model for the next release problem using ant colony optimization, where the user can define which requirements he/she would like to include or not in the next release. Employing humans and a simulator, an empirical study was performed that considers real-world and artificial instances. The achieved results demonstrate that the loss of score was, on average, 12% when it was compared with a solution with no human intervention. On the other hand, the algorithm generates solutions that have more than 80% of the met preferences, as defined by the users. Furthermore, the results showed that ACO can be an interesting choice as an interactive search engine, given the low quantity of interactions that are required to reach good solutions. © 2016 Elsevier B.V.",ACCEPTED,ACCEPTED,LOW,27,2016,Applied Soft Computing Journal,Ant colony optimization;  Interactive optimization;  Next release problem;  Search based software engineering,Article,,https://www.scopus.com/inward/record.uri?eid=2-s2.0-84979684914&doi=10.1016%2fj.asoc.2016.06.027&partnerID=40&md5=d989e332ade4a9bf5de40798cf8e2cec,49,1283-1296,10.1016/j.asoc.2016.06.027,,08/16/2021,,Y,N,N,N,N,N,N,,N,Y,N,N,N,none,10 iterations,every 10 iterations,score,"-1 (requirement should not be in the next release), 0 (no opinion), 1 (requirement should be)",N,Y,ant colony,none,binary,next release,objective function,Y,Y,none,none,score and requirement should or not be in the next release,N,N,Y,N
26208,Interactive software release planning with preferences base,1,"Dantas, A. and Yeltsin, I. and Araújo, A.A. and Souza, J.","The release planning is a complex task in the software development process and involves many aspects related to the decision about which requirements should be allocated in each system release. Several search based techniques have been proposed to tackle this problem, but in most cases the human expertise and preferences are not effectively considered. In this context, this work presents an approach in which the search is guided according to a Preferences Base supplied by the user. Preliminary empirical results showed the approach is able to find solutions which satisfy the most important user preferences. © Springer International Publishing Switzerland 2015.",ACCEPTED,ACCEPTED,LOW,7,2015,Lecture Notes in Computer Science (including subseries Lecture Notes in Artificial Intelligence and Lecture Notes in Bioinformatics),Interactive Genetic Algorithm;  Release planning;  SBSE,Conference Paper,,https://www.scopus.com/inward/record.uri?eid=2-s2.0-84951320256&doi=10.1007%2f978-3-319-22183-0_32&partnerID=40&md5=fe6580bb367201b1be9b0d6c861e382d,9275,341-346,10.1007/978-3-319-22183-0_32,,08/16/2021,,Y,N,N,N,N,N,N,,N,N,N,Y,N,not specified,not specified,not specified,not specified,not specified,N,Y,not specified,not specified,not specified,Software release planning,not specified,N,N,not specified,not specified,not specified,N,N,N,Y
26219,Machine learning for user modeling in an interactive genetic algorithm for the next release problem,1,"Araújo, A.A. and Paixão, M.","The Next Release Problem consists in selecting which requirements will be implemented in the next software release. For many SBSE approaches to the NRP, there is still a lack of ability to efficiently include the human opinion and its peculiarities in the search process. Most of these difficulties are due to the problem of the human fatigue. Thus, it is proposed the use of a machine learning technique to model the user and replace him in an Interactive Genetic Algorithm to the NRP. Intermediate results are able to show that an IGA can succesfully incorporate the user preferences in the final solution. © 2014 Springer International Publishing Switzerland.",ACCEPTED,ACCEPTED,LOW,18,2014,Lecture Notes in Computer Science (including subseries Lecture Notes in Artificial Intelligence and Lecture Notes in Bioinformatics),Interactive Genetic Algorithm;  Machine Learning;  Next Release Problem;  Search Based Software Engineering,Conference Paper,,https://www.scopus.com/inward/record.uri?eid=2-s2.0-84958541574&partnerID=40&md5=75ae8283e85fd3a749994f26994ad920,8636 LNCS,228-233,,,08/16/2021,,Y,N,N,N,N,N,N,,N,Y,N,N,N,not specified,not specified,not specified,score,1-100,N,Y,Interactive genetic algorithm,not specified,"Binary solution, where xi=1 -> requirement included, otherwise 0 = not included",next release problem,objective function,Y,N,Interactive genetic algorithm,not specified,"explicit (score - cost, etc) and implicit (subjective evaluation)",N,N,Y,N
26221,OPTI-SELECT: An interactive tool for user-in-the-loop feature selection in software product lines,1,"El Yamany, A.E. and Shaheen, M. and Sayyad, A.S.","Opti-Select is an Interactive Multi-objective feature analysis and optimization tool for software product lines configuration and feature models optimization based on an innovative UIL (User-In-the-loop) idea. In this tool, the experience of system analysts and stakeholders are merged with optimization techniques and algorithms. Opti-Select interactive tool is an integrated set of techniques providing step by step feature model and attribute configuration, selecting and excluding features, solution set optimization, and user interaction utilities that can all together reach satisfactory set of solutions that fits stakeholder preferences. Copyright is held by the owner/author(s).",ACCEPTED,ACCEPTED,LOW,18,2014,ACM International Conference Proceeding Series,Feature models;  Multi-objective optimization;  Optimal feature selection;  Search-based software engineering;  Software product lines;  User-in-the-loop (UIL),Conference Paper,,https://www.scopus.com/inward/record.uri?eid=2-s2.0-84907860169&doi=10.1145%2f2647908.2655977&partnerID=40&md5=2b5879bbe375bbe3b7a73c28d785393c,2,126-129,10.1145/2647908.2655977,,08/16/2021,,Y,N,N,N,N,N,N,,N,N,N,Y,N,Decided by DM,After seconds decided by DM,After seconds decided by DM,Selection of features to include or exclude,none,N,Y,IBEA,none,Simple XML Feature Model (SXFM),Loop Feature Selection in Software Product Lines,objective function,N,N,none,none,Features to be included and excluded,N,Y,N,N
26224,Preference-based many-objective evolutionary testing generates harder test cases for autonomous agents,1,"Kalboussi, S. and Bechikh, S. and Kessentini, M. and Ben Said, L.","Despite the high number of existing works in software testing within the SBSE community, there are very few ones that address the problematic of agent testing. The most prominent work in this direction is by Nguyen et al. [13], which formulates this problem as a bi-objective optimization problem to search for hard test cases from a robustness viewpoint. In this paper, we extend this work by: (1) proposing a new seven-objective formulation of this problem and (2) solving it by means of a preference-based many-objective evolutionary method. The obtained results show that our approach generates harder test cases than Nguyen et al. method ones. Moreover, Nguyen et al. method becomes a special case of our method since the user can incorporate his/her preferences within the search process by emphasizing some testing aspects over others. © 2013 Springer-Verlag.",ACCEPTED,ACCEPTED,LOW,8,2013,Lecture Notes in Computer Science (including subseries Lecture Notes in Artificial Intelligence and Lecture Notes in Bioinformatics),Agent testing;  many-objective optimization;  user's preferences,Conference Paper,,https://www.scopus.com/inward/record.uri?eid=2-s2.0-84884966250&doi=10.1007%2f978-3-642-39742-4_19&partnerID=40&md5=98aa006e07e1052351c487a818ebeefd,8084 LNCS,245-250,10.1007/978-3-642-39742-4_19,,08/16/2021,,Y,N,N,N,N,N,N,,N,Y,N,N,N,not specified,not specified,not specified,not specified,not specified,Y,N,not specified,not specified,not specified,Test generating,not specified,N,N,not specified,not specified,not specified,N,Y,N,N
26226,Practitioner-oriented visualization in an interactive search-based software test creation tool,1,"Marculescu, B. and Feldt, R. and Torkar, R.","Search-based software testing uses meta-heuristic search techniques to automate or partially automate testing tasks, such as test case generation or test data generation. It uses a fitness function to encode the quality characteristics that are relevant, for a given problem, and guides the search to acceptable solutions in a potentially vast search space. From an industrial perspective, this opens up the possibility of generating and evaluating lots of test cases without raising costs to unacceptable levels. First, however, the applicability of search-based software engineering in an industrial setting must be evaluated. In practice, it is difficult to develop a priori a fitness function that covers all practical aspects of a problem. Interaction with human experts offers access to experience that is otherwise unavailable and allows the creation of a more informed and accurate fitness function. Moreover, our industrial partner has already expressed a view that the knowledge and experience of domain specialists are more important to the overall quality of the systems they develop than software engineering expertise. In this paper we describe our application of Interactive Search Based Software Testing (ISBST) in an industrial setting. We used SBST to search for test cases for an industrial software module and based, in part, on interaction with a human domain specialist. Our evaluation showed that such an approach is feasible, though it also identified potential difficulties relating to the interaction between the domain specialist and the system. © 2013 IEEE.",ACCEPTED,ACCEPTED,LOW,9,2013,"Proceedings - Asia-Pacific Software Engineering Conference, APSEC",,Conference Paper,,https://www.scopus.com/inward/record.uri?eid=2-s2.0-84897378753&doi=10.1109%2fAPSEC.2013.120&partnerID=40&md5=ec34f0cc10950c7054cd6ee104d043a8,2,87-92,10.1109/APSEC.2013.120,,08/16/2021,,Y,N,N,N,N,N,N,,N,N,N,Y,N,not specified,not specified,not specified,re-weighting objective function,not specified,N,Y,not specified,not specified,not specified,Software Testing,selection and re-weighting of objective functions,N,N,not specified,not specified,not specified,N,N,N,Y
26230,Interactive requirements prioritization using a genetic algorithm,1,"Tonella, P. and Susi, A. and Palma, F.","Context: The order in which requirements are implemented affects the delivery of value to the end-user, but it also depends on technical constraints and resource availability. The outcome of requirements prioritization is a total ordering of requirements that best accommodates the various kinds of constraints and priorities. During requirements prioritization, some decisions on the relative importance of requirements or the feasibility of a given implementation order must necessarily resort to a human (e.g., the requirements analyst), possessing the involved knowledge. Objective: In this paper, we propose an Interactive Genetic Algorithm (IGA) that includes incremental knowledge acquisition and combines it with the existing constraints, such as dependencies and priorities. We also assess the performance of the proposed algorithm. Method: The validation of IGA was conducted on a real case study, by comparing the proposed algorithm with the state of the art, interactive prioritization technique Incomplete Analytic Hierarchy Process (IAHP). Results: The proposed method outperforms IAHP in terms of effectiveness, efficiency and robustness to decision maker errors. Conclusion: IGA produces a good approximation of the reference requirements ranking, requiring an acceptable manual effort and tolerating a reasonable human error rate. © 2012 Elsevier B.V. All rights reserved.",ACCEPTED,ACCEPTED,LOW,15,2013,Information and Software Technology,Interactive genetic algorithms;  Requirements prioritization;  Search based software engineering,Conference Paper,,https://www.scopus.com/inward/record.uri?eid=2-s2.0-84867399958&doi=10.1016%2fj.infsof.2012.07.003&partnerID=40&md5=9362769a97528a8088b9d7b69be96fe6,55,173-187,10.1016/j.infsof.2012.07.003,,08/16/2021,,Y,N,N,N,N,N,N,,N,Y,N,N,N,not specified,not specified,not specified,sort,none,N,Y,Interactive Genetic Algorithm,none,graph representing requirements with priority and dependences,requirements priorization,ranking,N,N,Interactive Genetic Algorithm,none,priority,N,Y,N,N
26232,A concept for an interactive search-based software testing system,1,"Marculescu, B. and Feldt, R. and Torkar, R.","Software is an increasingly important part of various products, although not always the dominant component. For these software-intensive systems it is common that the software is assembled, and sometimes even developed, by domain specialists rather than by software engineers. To leverage the domain specialists' knowledge while maintaining quality we need testing tools that require only limited knowledge of software testing. Since each domain has unique quality criteria and trade-offs and there is a large variation in both software modeling and implementation syntax as well as semantics it is not easy to envisage general software engineering support for testing tasks. Particularly not since such support must allow interaction between the domain specialists and the testing system for iterative development. In this paper we argue that search-based software testing can provide this type of general and interactive testing support and describe a proof of concept system to support this argument. The system separates the software engineering concerns from the domain concerns and allows domain specialists to interact with the system in order to select the quality criteria being used to determine the fitness of potential solutions. © 2012 Springer-Verlag.",ACCEPTED,ACCEPTED,LOW,10,2012,Lecture Notes in Computer Science (including subseries Lecture Notes in Artificial Intelligence and Lecture Notes in Bioinformatics),interactive search-based software engineering;  search-based software testing;  user centered,Conference Paper,,https://www.scopus.com/inward/record.uri?eid=2-s2.0-84866644612&doi=10.1007%2f978-3-642-33119-0_21&partnerID=40&md5=30678e939bfdce884fdfa11e254153b4,7515 LNCS,273-278,10.1007/978-3-642-33119-0_21,,08/16/2021,,Y,N,N,N,N,N,N,,N,N,N,Y,N,not specified,not specified,not specified,re-weighting objective function,not specified,N,Y,not specified,not specified,not specified,Software Testing,objective function,N,N,not specified,not specified,selection and re-weighting of objective functions,N,N,N,Y
26240,Evolving colors in user interfaces by interactive genetic algorithm,1,"Birtolo, C. and Pagano, P. and Troiano, L.","Color selection in designing user interfaces is addressed by an Interactive Genetic Algorithm. The proposed approach is aimed at finding the optimal trade-off between different and sometimes conflicting constraints, without any explicit model of user preferences and abilities. Experimentation investigates the algorithm convergence under several conditions and user behavior. ©2009 IEEE.",ACCEPTED,ACCEPTED,LOW,15,2009,"2009 World Congress on Nature and Biologically Inspired Computing, NABIC 2009 - Proceedings",Accessibility;  Color vision;  Interactive genetic algorithms;  Search based software engineering;  User interface design,Conference Paper,,https://www.scopus.com/inward/record.uri?eid=2-s2.0-77949644937&doi=10.1109%2fNABIC.2009.5393307&partnerID=40&md5=1b972c68ea5edc9b768a49e36e974c36,,349-355,10.1109/NABIC.2009.5393307,,08/16/2021,,Y,N,N,N,N,N,N,,Y,N,N,N,N,not specified,not specified,not specified,the DM assign if pallete is fine or not,none,Y,N,interactive genetic algorithm,cluster algorithm,bit string,Colors in User Interfaces,fitness,Y,N,not specified,not specified, if pallete is fine or not,Y,N,N,N
